{
  "schema_version": "1.0.0",
  "assessment": {
    "assessment_id": "nz_phase2_maths_snapshot_2025",
    "name": "2025 Phase 2 Maths Snapshot",
    "publisher_year": 2025,
    "learning_phase": "Phase 2",
    "intended_year_range": {
      "min": 3,
      "max": 6
    },
    "notes": [
      "Formative snapshot; use sections independently.",
      "Not standardised or norm referenced.",
      "Do not complete all sections in one sitting."
    ],
    "source": {
      "file_name": "2025 Phase 2 Maths Snapshot Answers.pdf",
      "page_count": 11
    }
  },
  "sections": [
    {
      "section_id": "sec_01",
      "section_number": 1,
      "title": "Place Value",
      "strand": "Number Structure",
      "topic": "Read and write numbers and identify 1/10/100 before and after",
      "instructions": "Answer each item. Skips are allowed and tracked.",
      "time_mode": "untimed",
      "variants": [
        {
          "variant_id": "var_sec_01_y3",
          "year_level": 3,
          "item_refs": [
            "itm_sec_01_y3_q01",
            "itm_sec_01_y3_q02",
            "itm_sec_01_y3_q03",
            "itm_sec_01_y3_q04",
            "itm_sec_01_y3_q05",
            "itm_sec_01_y3_q06",
            "itm_sec_01_y3_q07",
            "itm_sec_01_y3_q08",
            "itm_sec_01_y3_q09",
            "itm_sec_01_y3_q10",
            "itm_sec_01_y3_q11",
            "itm_sec_01_y3_q12",
            "itm_sec_01_y3_q13",
            "itm_sec_01_y3_q14",
            "itm_sec_01_y3_q15"
          ]
        },
        {
          "variant_id": "var_sec_01_y4",
          "year_level": 4,
          "item_refs": [
            "itm_sec_01_y4_q01",
            "itm_sec_01_y4_q02",
            "itm_sec_01_y4_q03",
            "itm_sec_01_y4_q04",
            "itm_sec_01_y4_q05",
            "itm_sec_01_y4_q06",
            "itm_sec_01_y4_q07",
            "itm_sec_01_y4_q08",
            "itm_sec_01_y4_q09",
            "itm_sec_01_y4_q10",
            "itm_sec_01_y4_q11",
            "itm_sec_01_y4_q12",
            "itm_sec_01_y4_q13",
            "itm_sec_01_y4_q14",
            "itm_sec_01_y4_q15"
          ]
        },
        {
          "variant_id": "var_sec_01_y5",
          "year_level": 5,
          "item_refs": [
            "itm_sec_01_y5_q01",
            "itm_sec_01_y5_q02",
            "itm_sec_01_y5_q03",
            "itm_sec_01_y5_q04",
            "itm_sec_01_y5_q05",
            "itm_sec_01_y5_q06",
            "itm_sec_01_y5_q07",
            "itm_sec_01_y5_q08",
            "itm_sec_01_y5_q09",
            "itm_sec_01_y5_q10",
            "itm_sec_01_y5_q11",
            "itm_sec_01_y5_q12",
            "itm_sec_01_y5_q13",
            "itm_sec_01_y5_q14",
            "itm_sec_01_y5_q15"
          ]
        },
        {
          "variant_id": "var_sec_01_y6",
          "year_level": 6,
          "item_refs": [
            "itm_sec_01_y6_q01",
            "itm_sec_01_y6_q02",
            "itm_sec_01_y6_q03",
            "itm_sec_01_y6_q04",
            "itm_sec_01_y6_q05",
            "itm_sec_01_y6_q06",
            "itm_sec_01_y6_q07",
            "itm_sec_01_y6_q08",
            "itm_sec_01_y6_q09",
            "itm_sec_01_y6_q10",
            "itm_sec_01_y6_q11",
            "itm_sec_01_y6_q12",
            "itm_sec_01_y6_q13",
            "itm_sec_01_y6_q14",
            "itm_sec_01_y6_q15"
          ]
        }
      ],
      "mastery_thresholds": {
        "secure_pct": 80,
        "developing_pct": 50
      }
    },
    {
      "section_id": "sec_02",
      "section_number": 2,
      "title": "Round Whole Numbers and Decimals",
      "strand": "Number Operations",
      "topic": "Round whole numbers and decimals",
      "instructions": "Answer each item. Skips are allowed and tracked.",
      "time_mode": "untimed",
      "variants": [
        {
          "variant_id": "var_sec_02_y3",
          "year_level": 3,
          "item_refs": [
            "itm_sec_02_y3_q01",
            "itm_sec_02_y3_q02"
          ]
        },
        {
          "variant_id": "var_sec_02_y4",
          "year_level": 4,
          "item_refs": [
            "itm_sec_02_y4_q01",
            "itm_sec_02_y4_q02",
            "itm_sec_02_y4_q03",
            "itm_sec_02_y4_q04"
          ]
        },
        {
          "variant_id": "var_sec_02_y5",
          "year_level": 5,
          "item_refs": [
            "itm_sec_02_y5_q01",
            "itm_sec_02_y5_q02",
            "itm_sec_02_y5_q03",
            "itm_sec_02_y5_q04",
            "itm_sec_02_y5_q05"
          ]
        },
        {
          "variant_id": "var_sec_02_y6",
          "year_level": 6,
          "item_refs": [
            "itm_sec_02_y6_q01",
            "itm_sec_02_y6_q02",
            "itm_sec_02_y6_q03",
            "itm_sec_02_y6_q04",
            "itm_sec_02_y6_q05"
          ]
        }
      ],
      "mastery_thresholds": {
        "secure_pct": 80,
        "developing_pct": 50
      }
    },
    {
      "section_id": "sec_03",
      "section_number": 3,
      "title": "Add and Subtract Whole Numbers",
      "strand": "Number Operations",
      "topic": "Add and subtract whole numbers",
      "instructions": "Answer each item. Skips are allowed and tracked.",
      "time_mode": "untimed",
      "variants": [
        {
          "variant_id": "var_sec_03_y3",
          "year_level": 3,
          "item_refs": [
            "itm_sec_03_y3_q01",
            "itm_sec_03_y3_q02"
          ]
        },
        {
          "variant_id": "var_sec_03_y4",
          "year_level": 4,
          "item_refs": [
            "itm_sec_03_y4_q01",
            "itm_sec_03_y4_q02",
            "itm_sec_03_y4_q03",
            "itm_sec_03_y4_q04"
          ]
        },
        {
          "variant_id": "var_sec_03_y5",
          "year_level": 5,
          "item_refs": [
            "itm_sec_03_y5_q01",
            "itm_sec_03_y5_q02"
          ]
        },
        {
          "variant_id": "var_sec_03_y6",
          "year_level": 6,
          "item_refs": [
            "itm_sec_03_y6_q01",
            "itm_sec_03_y6_q02"
          ]
        }
      ],
      "mastery_thresholds": {
        "secure_pct": 80,
        "developing_pct": 50
      }
    },
    {
      "section_id": "sec_04",
      "section_number": 4,
      "title": "Recall Multiplication and Division Facts",
      "strand": "Number Operations",
      "topic": "Basic facts recall",
      "instructions": "Run in timed mode. Each item can be shown for 4 seconds. Skips are allowed.",
      "time_mode": "timed_flash",
      "variants": [
        {
          "variant_id": "var_sec_04_y3",
          "year_level": 3,
          "item_refs": [
            "itm_sec_04_y3_q01",
            "itm_sec_04_y3_q02",
            "itm_sec_04_y3_q03",
            "itm_sec_04_y3_q04",
            "itm_sec_04_y3_q05",
            "itm_sec_04_y3_q06",
            "itm_sec_04_y3_q07",
            "itm_sec_04_y3_q08",
            "itm_sec_04_y3_q09",
            "itm_sec_04_y3_q10"
          ]
        },
        {
          "variant_id": "var_sec_04_y4",
          "year_level": 4,
          "item_refs": [
            "itm_sec_04_y4_q01",
            "itm_sec_04_y4_q02",
            "itm_sec_04_y4_q03",
            "itm_sec_04_y4_q04",
            "itm_sec_04_y4_q05",
            "itm_sec_04_y4_q06",
            "itm_sec_04_y4_q07",
            "itm_sec_04_y4_q08",
            "itm_sec_04_y4_q09",
            "itm_sec_04_y4_q10"
          ]
        },
        {
          "variant_id": "var_sec_04_y5",
          "year_level": 5,
          "item_refs": [
            "itm_sec_04_y5_q01",
            "itm_sec_04_y5_q02",
            "itm_sec_04_y5_q03",
            "itm_sec_04_y5_q04",
            "itm_sec_04_y5_q05",
            "itm_sec_04_y5_q06",
            "itm_sec_04_y5_q07",
            "itm_sec_04_y5_q08",
            "itm_sec_04_y5_q09",
            "itm_sec_04_y5_q10"
          ]
        },
        {
          "variant_id": "var_sec_04_y6",
          "year_level": 6,
          "item_refs": [
            "itm_sec_04_y6_q01",
            "itm_sec_04_y6_q02",
            "itm_sec_04_y6_q03",
            "itm_sec_04_y6_q04",
            "itm_sec_04_y6_q05",
            "itm_sec_04_y6_q06",
            "itm_sec_04_y6_q07",
            "itm_sec_04_y6_q08",
            "itm_sec_04_y6_q09",
            "itm_sec_04_y6_q10"
          ]
        }
      ],
      "mastery_thresholds": {
        "secure_pct": 80,
        "developing_pct": 50
      },
      "default_time_limit_seconds": 4
    },
    {
      "section_id": "sec_05a",
      "section_number": 5,
      "title": "Multiplication Operations",
      "strand": "Number Operations",
      "topic": "Multiply whole numbers",
      "instructions": "Answer each item. Skips are allowed and tracked.",
      "time_mode": "untimed",
      "variants": [
        {
          "variant_id": "var_sec_05a_y3",
          "year_level": 3,
          "item_refs": [
            "itm_sec_05a_y3_q01",
            "itm_sec_05a_y3_q02"
          ]
        },
        {
          "variant_id": "var_sec_05a_y4",
          "year_level": 4,
          "item_refs": [
            "itm_sec_05a_y4_q01",
            "itm_sec_05a_y4_q02"
          ]
        },
        {
          "variant_id": "var_sec_05a_y5",
          "year_level": 5,
          "item_refs": [
            "itm_sec_05a_y5_q01",
            "itm_sec_05a_y5_q02"
          ]
        },
        {
          "variant_id": "var_sec_05a_y6",
          "year_level": 6,
          "item_refs": [
            "itm_sec_05a_y6_q01",
            "itm_sec_05a_y6_q02"
          ]
        }
      ],
      "mastery_thresholds": {
        "secure_pct": 80,
        "developing_pct": 50
      },
      "part": "a"
    },
    {
      "section_id": "sec_05b",
      "section_number": 5,
      "title": "Division Operations",
      "strand": "Number Operations",
      "topic": "Divide whole numbers including remainders",